{
  "product_id":"blue_left",
  "product_asset":"data/intermediate/phase2a_fix_confirmed_openings_20261014T144510578271Z/blue_left/segmentation_result.json",
  "agent_analysis":"configs/examples/observations/blue_disc.json",
  "reference_catalog":"data/references/amazon_B0HGGJZ92H/catalog.json",
  "reference_analysis":"data/references/amazon_B0HGGJZ92H/reference_style.json",
  "product_facts":{
    "diameter_cm":{"value":30,"status":"human_verified","method":"explicit_prior_user_statement","reviewer":"项目用户（本次对话）","provenance":{"kind":"user_statement","product_id":"blue_left","statement":"转盘直径30厘米，重量500g，材质为复合材料。","prior_record":"reports/phase4a/product_facts.json"}},
    "weight_g":{"value":500,"status":"human_verified","method":"explicit_prior_user_statement","reviewer":"项目用户（本次对话）","provenance":{"kind":"user_statement","product_id":"blue_left","statement":"转盘直径30厘米，重量500g，材质为复合材料。","prior_record":"reports/phase4a/product_facts.json"}},
    "material":{"value":"Composite material","status":"human_verified","method":"explicit_prior_user_statement","reviewer":"项目用户（本次对话）","provenance":{"kind":"user_statement","product_id":"blue_left","statement":"转盘直径30厘米，重量500g，材质为复合材料。","prior_record":"reports/phase4a/product_facts.json"}},
    "lower_hole":{"value":"Confirmed lower through-hole","status":"human_verified","method":"explicit_prior_structure_confirmation","reviewer":"项目用户（本次对话）","provenance":{"kind":"user_statement","product_id":"blue_left","statement":"中心金属件下方的小白圆是真实贯穿孔。","prior_record":"data/intermediate/phase2a_fix_confirmed_openings_20261014T144510578271Z/blue_left/review_record.json"}}
  },
  "output_count":7,
  "review_policy":{"mode":"strict"},
  "generation_budget":{"max_new_backgrounds":2},
  "scene":{"level":2,"presentation":"editorial_panel"},
  "output_dir":"data/outputs/phase4b/blue_left"
}
