{
  "product_id":"unconfigured_silver_asset",
  "product_asset":"data/intermediate/phase2a/silver_six/segmentation_result.json",
  "agent_analysis":"configs/examples/observations/cold_start_new_sku.json",
  "output_count":1,
  "shot_types":["white_hero"],
  "generation_budget":{"max_new_backgrounds":0},
  "output_dir":"data/outputs/phase4b/cold_start_new_sku"
}
